{"canonicalChecksum":"f7fc35142f29f2fc61873b758386e713af6af1ef89980b86f26b1d5bec7e9076","climateBindingChecksum":"40ceb3a9e43af2223bc7d4af25f8c9558f3658739401a09b4f27d98d42b83b73","climatePreset":"COLD_MARITIME","contractVersion":"ice-fjord-preset-contract-v1","estimatedWorkUnits":7420,"fjordFeatureId":"marine-fjord","fjordGeometryChecksum":"523ac723372c1956bcebff9262145acf8b13360de5a77256fbe7e7e5cfbb3cd4","geometryChecksum":"b24310f1737f6fd475d57b4d5485e1a802532db06c7f5156b4aa15d94ac66315","planVersion":1,"presetId":"ice-fjord.valley-ice","snowProfileId":"cold-snow-ice-profile","supportRadiusXZ":4,"valleyGlacierFeatureId":"valley-ice","valleyGlacierPlanChecksum":"16791695235ff6db0e8f528c3b6430a9a712e180acdca36223dd80875be6bdc5"}